{
  "schema_version": "1.0.0",
  "extractor": "pasol-features-pe",
  "extractor_version": "0.1.0",
  "source": {"parser":"pasol-pe-parser","parser_version":"0.1.0","parser_schema_version":"1.0.0","sha256":"3333333333333333333333333333333333333333333333333333333333333333","file_type":"pe64"},
  "status": "complete",
  "features": [{"id":"pe.sections.writable_executable.count","state":"present","value":1,"evidence":[{"path":"/metadata/sections","summary":"Writable and executable section count"}]}],
  "warnings": []
}
