{"schema_version":"1.0.0","extractor":"pasol-features-pe","extractor_version":"0.1.0","source":{"parser":"pasol-pe-parser","parser_version":"0.1.0","parser_schema_version":"1.0.0","sha256":"2222222222222222222222222222222222222222222222222222222222222222","file_type":"pe64"},"status":"complete","features":[{"id":"file.parser.partial","state":"present","value":false,"evidence":[{"path":"/status","summary":"Parser reported completion status"}]},{"id":"file.parser.warning_count","state":"present","value":0,"evidence":[{"path":"/warnings","summary":"Parser warning count"}]},{"id":"file.sha256.present","state":"present","value":true,"evidence":[{"path":"/sha256","summary":"Parser report contains SHA-256"}]},{"id":"file.size.bytes","state":"present","value":2048,"evidence":[{"path":"/size","summary":"Parser reported file size"}]},{"id":"file.type","state":"present","value":"pe64","evidence":[{"path":"/file_type","summary":"Parser identified file type"}]},{"id":"pe.architecture","state":"present","value":"x86_64","evidence":[{"path":"/metadata/architecture/name","summary":"PE architecture name"}]},{"id":"pe.certificate_table.pkcs7_present","state":"present","value":false,"evidence":[{"path":"/metadata/authenticode/pkcs7_present","summary":"Parser reported structure presence"}]},{"id":"pe.certificate_table.present","state":"present","value":false,"evidence":[{"path":"/metadata/authenticode/certificate_table_present","summary":"Parser reported structure presence"}]},{"id":"pe.debug.present","state":"present","value":true,"evidence":[{"path":"/metadata/debug","summary":"Parser reported structure presence"}]},{"id":"pe.entry_point.rva","state":"present","value":"0x1000","evidence":[{"path":"/metadata/entry_point_rva","summary":"PE entry point RVA"}]},{"id":"pe.exports.count","state":"present","value":0,"evidence":[{"path":"/metadata/exports","summary":"Parser collection count"}]},{"id":"pe.exports.named_count","state":"present","value":0,"evidence":[{"path":"/metadata/exports","summary":"Parser nested item count"}]},{"id":"pe.image_base","state":"present","value":"0x140000000","evidence":[{"path":"/metadata/image_base","summary":"PE image base"}]},{"id":"pe.imports.dll_count","state":"present","value":0,"evidence":[{"path":"/metadata/imports","summary":"Parser collection count"}]},{"id":"pe.imports.symbol_count","state":"present","value":0,"evidence":[{"path":"/metadata/imports","summary":"Parser nested item count"}]},{"id":"pe.machine.raw","state":"present","value":34404,"evidence":[{"path":"/metadata/architecture/raw","summary":"PE machine value"}]},{"id":"pe.resources.count","state":"present","value":0,"evidence":[{"path":"/metadata/resources","summary":"Parser collection count"}]},{"id":"pe.section.0.permissions.writable_executable","state":"present","value":false,"evidence":[{"path":"/metadata/sections/0/permissions","summary":"Section write and execute permissions"}]},{"id":"pe.section.entropy.high_count","state":"present","value":0,"evidence":[{"path":"/metadata/sections","summary":"Count of sections at or above entropy threshold 7.0"}]},{"id":"pe.section.entropy.maximum","state":"present","value":6.0,"evidence":[{"path":"/metadata/sections","summary":"Maximum reported section entropy"}]},{"id":"pe.section.names","state":"present","value":[".text"],"evidence":[{"path":"/metadata/sections","summary":"Reported section names"}]},{"id":"pe.sections.count","state":"present","value":1,"evidence":[{"path":"/metadata/sections","summary":"PE section count"}]},{"id":"pe.sections.executable.count","state":"present","value":1,"evidence":[{"path":"/metadata/sections","summary":"Executable section count"}]},{"id":"pe.sections.writable.count","state":"present","value":0,"evidence":[{"path":"/metadata/sections","summary":"Writable section count"}]},{"id":"pe.sections.writable_executable.count","state":"present","value":0,"evidence":[{"path":"/metadata/sections","summary":"Writable and executable section count"}]},{"id":"pe.subsystem","state":"present","value":"windows_cui","evidence":[{"path":"/metadata/subsystem/name","summary":"PE subsystem name"}]},{"id":"pe.version.present","state":"present","value":false,"evidence":[{"path":"/metadata/version_info","summary":"Parser reported structure presence"}]}],"warnings":[]}
